{
  "$schema": "https://json-schema.org/draft/2020-12/schema",
  "$id": "https://github.com/prefix-dev/purl-associator/schemas/cve-ai-draft.schema.json",
  "title": "purl-associator AI CVE review draft",
  "description": "One file per AI run, written to mappings/cve_ai_drafts/<ts>--<runid>.json. The `openvex` block is a full OpenVEX 0.2.0 document (validated separately against schemas/openvex-schema.json) carrying suggested statements. The `assessments` block holds the structured per-advisory reasoning the AI produced. Drafts are never merged into the published bundle; a human must promote one into mappings/cve_contributions/.",
  "type": "object",
  "required": ["schema_version", "draft", "model", "generated_at", "run_id", "openvex", "assessments"],
  "additionalProperties": false,
  "properties": {
    "schema_version": { "type": "integer", "const": 1 },
    "draft": { "type": "boolean", "const": true },
    "model": { "type": "string", "minLength": 1 },
    "backend": { "type": "string", "enum": ["api", "claude-cli"] },
    "generated_at": { "type": "string" },
    "run_id": { "type": "string", "minLength": 1 },
    "prompt_version": { "type": "string", "minLength": 1 },
    "openvex": { "type": "object" },
    "assessments": {
      "type": "object",
      "description": "Map from `<package>::<advisory_id>` to a structured assessment. The key convention is enforced by patternProperties so the SPA and merge_ai_drafts can rely on it; the actual canonical (package, advisory_id) come from the inner block's fields.",
      "additionalProperties": false,
      "patternProperties": {
        "^[^:]+::(GHSA-|CVE-|OSV-|PYSEC-|RUSTSEC-|GO-|MAL-|NPM-|PLDB-|HSEC-|ASB-|ALAS-|RHSA-)": {
          "type": "object",
          "required": [
            "package",
            "rationale",
            "affected_versions",
            "runtime_applicability",
            "severity_in_conda_context",
            "severity_seen"
          ],
          "additionalProperties": false,
          "properties": {
          "package": { "type": "string", "minLength": 1 },
          "advisory_id": { "type": "string" },
          "prompt_version": { "type": "string", "minLength": 1 },
          "rationale": {
            "type": "string",
            "description": "Narrative prose (3-6 sentences) explaining why the AI accepts or rejects this CVE match. Surfaced prominently in the SPA's draft panel and the workflow PR body."
          },
          "openvex_status": {
            "type": "string",
            "enum": ["affected", "not_affected", "fixed", "under_investigation"]
          },
          "openvex_justification": { "type": ["string", "null"] },
          "openvex_impact_statement": { "type": ["string", "null"] },
          "openvex_action_statement": { "type": ["string", "null"] },
          "affected_versions": {
            "type": "object",
            "required": ["agrees_with_match", "reasoning"],
            "additionalProperties": false,
            "properties": {
              "agrees_with_match": { "type": "boolean" },
              "suggested_adds": { "type": "array", "items": { "type": "string" } },
              "suggested_removes": { "type": "array", "items": { "type": "string" } },
              "reasoning": { "type": "string" }
            }
          },
          "runtime_applicability": {
            "type": "object",
            "required": ["applies", "reasoning"],
            "additionalProperties": false,
            "properties": {
              "applies": {
                "type": "string",
                "enum": ["yes", "no", "partial", "unknown"]
              },
              "reasoning": { "type": "string" }
            }
          },
          "severity_in_conda_context": {
            "type": "object",
            "required": ["assessment", "reasoning"],
            "additionalProperties": false,
            "properties": {
              "assessment": {
                "type": "string",
                "enum": ["lower", "same", "higher", "unknown"]
              },
              "reasoning": { "type": "string" }
            }
          },
          "notes": { "type": "string" },
          "severity_seen": {
            "type": "object",
            "additionalProperties": false,
            "properties": {
              "cvss": { "type": ["number", "null"] },
              "level": { "type": ["string", "null"] }
            }
          },
          "inputs_seen": {
            "type": "object",
            "description": "Optional SHA-256 fingerprint over the prompt's other inputs (package metadata, OSV summary/details/references/affected, source_purls, affected_versions, affects_future, latest_version). When present, a mismatch triggers a re-draft alongside severity drift. Absent on drafts written before the field existed; absence is treated as 'match' by the reviewer.",
            "additionalProperties": false,
            "properties": {
              "hash": {
                "type": "string",
                "pattern": "^[a-f0-9]{64}$"
              }
            },
            "required": ["hash"]
          }
        }
        }
      }
    },
    "skipped": {
      "type": "array",
      "items": {
        "type": "object",
        "required": ["package", "advisory_id", "reason"],
        "additionalProperties": false,
        "properties": {
          "package": { "type": "string" },
          "advisory_id": { "type": "string" },
          "reason": { "type": "string" }
        }
      }
    }
  }
}
