{
  "assessments": {},
  "backend": "api",
  "draft": true,
  "generated_at": "2026-06-08T21:08:35+00:00",
  "model": "claude-sonnet-4-6",
  "openvex": {
    "@context": "https://openvex.dev/ns/v0.2.0",
    "@id": "https://github.com/prefix-dev/purl-associator/ai-draft/35171a",
    "author": "purl-associator AI reviewer (claude-sonnet-4-6)",
    "statements": [],
    "timestamp": "2026-06-08T21:08:35+00:00",
    "tooling": "purl-associator/scripts.cve_ai_review",
    "version": 1
  },
  "prompt_version": "2026-06-03.verify-conda-shipped-versions-v1",
  "run_id": "35171a",
  "schema_version": 1,
  "skipped": [
    {
      "advisory_id": "GHSA-5882-5rx9-xgxp",
      "package": "crawl4ai",
      "reason": "human_openvex_exists"
    },
    {
      "advisory_id": "GHSA-mw26-5g2v-hqw3",
      "package": "deepdiff",
      "reason": "human_openvex_exists"
    },
    {
      "advisory_id": "GHSA-vv7q-7jx5-f767",
      "package": "fastmcp",
      "reason": "human_openvex_exists"
    },
    {
      "advisory_id": "GHSA-554w-xh4j-8w64",
      "package": "mlflow-pipelines",
      "reason": "human_openvex_exists"
    },
    {
      "advisory_id": "GHSA-5p3h-7fwh-92rc",
      "package": "mlflow-pipelines",
      "reason": "human_openvex_exists"
    },
    {
      "advisory_id": "GHSA-5q6c-ffvg-xcm9",
      "package": "mlflow-pipelines",
      "reason": "human_openvex_exists"
    },
    {
      "advisory_id": "GHSA-f798-qm4r-23r5",
      "package": "mlflow-pipelines",
      "reason": "human_openvex_exists"
    },
    {
      "advisory_id": "GHSA-fmxj-6h9g-6vw3",
      "package": "mlflow-pipelines",
      "reason": "human_openvex_exists"
    },
    {
      "advisory_id": "GHSA-r23q-823p-vmf7",
      "package": "mlflow-pipelines",
      "reason": "human_openvex_exists"
    },
    {
      "advisory_id": "GHSA-r23q-823p-vmf7",
      "package": "mlflow-ui",
      "reason": "human_openvex_exists"
    },
    {
      "advisory_id": "GHSA-554w-xh4j-8w64",
      "package": "mlflow",
      "reason": "human_openvex_exists"
    },
    {
      "advisory_id": "GHSA-5p3h-7fwh-92rc",
      "package": "mlflow",
      "reason": "human_openvex_exists"
    },
    {
      "advisory_id": "GHSA-5q6c-ffvg-xcm9",
      "package": "mlflow",
      "reason": "human_openvex_exists"
    },
    {
      "advisory_id": "GHSA-f798-qm4r-23r5",
      "package": "mlflow",
      "reason": "human_openvex_exists"
    },
    {
      "advisory_id": "GHSA-fmxj-6h9g-6vw3",
      "package": "mlflow",
      "reason": "human_openvex_exists"
    },
    {
      "advisory_id": "GHSA-r23q-823p-vmf7",
      "package": "mlflow",
      "reason": "human_openvex_exists"
    },
    {
      "advisory_id": "GHSA-7p94-766c-hgjp",
      "package": "nltk",
      "reason": "human_openvex_exists"
    },
    {
      "advisory_id": "PYSEC-2026-99",
      "package": "nltk",
      "reason": "human_openvex_exists"
    },
    {
      "advisory_id": "GHSA-hj4w-hm2g-p6w5",
      "package": "vllm",
      "reason": "human_openvex_exists"
    },
    {
      "advisory_id": "GHSA-f3f8-vx3w-hp5q",
      "package": "codechecker",
      "reason": "human_openvex_exists"
    },
    {
      "advisory_id": "GHSA-329j-jfvr-rhr6",
      "package": "pyspark",
      "reason": "human_openvex_exists"
    },
    {
      "advisory_id": "GHSA-mxvw-cj37-8g2h",
      "package": "aim",
      "reason": "human_openvex_exists"
    },
    {
      "advisory_id": "PYSEC-2023-314",
      "package": "airflow-with-aiobotocore",
      "reason": "human_openvex_exists"
    },
    {
      "advisory_id": "PYSEC-2023-314",
      "package": "airflow-with-airbyte",
      "reason": "human_openvex_exists"
    },
    {
      "advisory_id": "PYSEC-2023-314",
      "package": "airflow-with-alibaba",
      "reason": "human_openvex_exists"
    },
    {
      "advisory_id": "PYSEC-2023-314",
      "package": "airflow-with-all-core",
      "reason": "human_openvex_exists"
    },
    {
      "advisory_id": "PYSEC-2023-314",
      "package": "airflow-with-all",
      "reason": "human_openvex_exists"
    },
    {
      "advisory_id": "PYSEC-2023-314",
      "package": "airflow-with-amazon",
      "reason": "human_openvex_exists"
    },
    {
      "advisory_id": "GHSA-7wqf-h36w-47mc",
      "package": "airflow-with-apache-atlas",
      "reason": "human_openvex_exists"
    },
    {
      "advisory_id": "GHSA-c732-xvv8-g94c",
      "package": "airflow-with-apache-atlas",
      "reason": "human_openvex_exists"
    },
    {
      "advisory_id": "GHSA-rmf2-pwfq-h75j",
      "package": "airflow-with-apache-atlas",
      "reason": "human_openvex_exists"
    },
    {
      "advisory_id": "PYSEC-2023-314",
      "package": "airflow-with-apache-atlas",
      "reason": "human_openvex_exists"
    },
    {
      "advisory_id": "GHSA-7wqf-h36w-47mc",
      "package": "airflow-with-apache-beam",
      "reason": "human_openvex_exists"
    },
    {
      "advisory_id": "GHSA-c732-xvv8-g94c",
      "package": "airflow-with-apache-beam",
      "reason": "human_openvex_exists"
    },
    {
      "advisory_id": "GHSA-rmf2-pwfq-h75j",
      "package": "airflow-with-apache-beam",
      "reason": "human_openvex_exists"
    },
    {
      "advisory_id": "PYSEC-2023-314",
      "package": "airflow-with-apache-beam",
      "reason": "human_openvex_exists"
    },
    {
      "advisory_id": "PYSEC-2023-314",
      "package": "airflow-with-apache-cassandra",
      "reason": "human_openvex_exists"
    },
    {
      "advisory_id": "PYSEC-2023-314",
      "package": "airflow-with-apache-drill",
      "reason": "human_openvex_exists"
    },
    {
      "advisory_id": "PYSEC-2023-314",
      "package": "airflow-with-apache-druid",
      "reason": "human_openvex_exists"
    },
    {
      "advisory_id": "PYSEC-2023-314",
      "package": "airflow-with-apache-flink",
      "reason": "human_openvex_exists"
    },
    {
      "advisory_id": "PYSEC-2023-314",
      "package": "airflow-with-apache-hdfs",
      "reason": "human_openvex_exists"
    },
    {
      "advisory_id": "PYSEC-2023-314",
      "package": "airflow-with-apache-hive",
      "reason": "human_openvex_exists"
    },
    {
      "advisory_id": "PYSEC-2023-314",
      "package": "airflow-with-apache-iceberg",
      "reason": "human_openvex_exists"
    },
    {
      "advisory_id": "PYSEC-2023-314",
      "package": "airflow-with-apache-kafka",
      "reason": "human_openvex_exists"
    },
    {
      "advisory_id": "PYSEC-2023-314",
      "package": "airflow-with-apache-kylin",
      "reason": "human_openvex_exists"
    },
    {
      "advisory_id": "PYSEC-2023-314",
      "package": "airflow-with-apache-livy",
      "reason": "human_openvex_exists"
    },
    {
      "advisory_id": "PYSEC-2023-314",
      "package": "airflow-with-apache-pig",
      "reason": "human_openvex_exists"
    },
    {
      "advisory_id": "PYSEC-2023-314",
      "package": "airflow-with-apache-pinot",
      "reason": "human_openvex_exists"
    },
    {
      "advisory_id": "PYSEC-2023-314",
      "package": "airflow-with-apache-spark",
      "reason": "human_openvex_exists"
    },
    {
      "advisory_id": "GHSA-7wqf-h36w-47mc",
      "package": "airflow-with-apache-webhdfs",
      "reason": "human_openvex_exists"
    },
    {
      "advisory_id": "GHSA-c732-xvv8-g94c",
      "package": "airflow-with-apache-webhdfs",
      "reason": "human_openvex_exists"
    },
    {
      "advisory_id": "GHSA-rmf2-pwfq-h75j",
      "package": "airflow-with-apache-webhdfs",
      "reason": "human_openvex_exists"
    },
    {
      "advisory_id": "PYSEC-2023-314",
      "package": "airflow-with-apache-webhdfs",
      "reason": "human_openvex_exists"
    },
    {
      "advisory_id": "PYSEC-2023-314",
      "package": "airflow-with-apprise",
      "reason": "human_openvex_exists"
    },
    {
      "advisory_id": "PYSEC-2023-314",
      "package": "airflow-with-arangodb",
      "reason": "human_openvex_exists"
    },
    {
      "advisory_id": "PYSEC-2023-314",
      "package": "airflow-with-asana",
      "reason": "human_openvex_exists"
    },
    {
      "advisory_id": "GHSA-7wqf-h36w-47mc",
      "package": "airflow-with-async",
      "reason": "human_openvex_exists"
    },
    {
      "advisory_id": "GHSA-c732-xvv8-g94c",
      "package": "airflow-with-async",
      "reason": "human_openvex_exists"
    },
    {
      "advisory_id": "GHSA-rmf2-pwfq-h75j",
      "package": "airflow-with-async",
      "reason": "human_openvex_exists"
    },
    {
      "advisory_id": "PYSEC-2023-314",
      "package": "airflow-with-async",
      "reason": "human_openvex_exists"
    },
    {
      "advisory_id": "PYSEC-2025-87",
      "package": "airflow-with-async",
      "reason": "human_openvex_exists"
    },
    {
      "advisory_id": "PYSEC-2023-314",
      "package": "airflow-with-atlassian-jira",
      "reason": "human_openvex_exists"
    },
    {
      "advisory_id": "GHSA-7wqf-h36w-47mc",
      "package": "airflow-with-celery",
      "reason": "human_openvex_exists"
    },
    {
      "advisory_id": "GHSA-c732-xvv8-g94c",
      "package": "airflow-with-celery",
      "reason": "human_openvex_exists"
    },
    {
      "advisory_id": "GHSA-rmf2-pwfq-h75j",
      "package": "airflow-with-celery",
      "reason": "human_openvex_exists"
    },
    {
      "advisory_id": "PYSEC-2023-314",
      "package": "airflow-with-celery",
      "reason": "human_openvex_exists"
    },
    {
      "advisory_id": "PYSEC-2025-87",
      "package": "airflow-with-celery",
      "reason": "human_openvex_exists"
    },
    {
      "advisory_id": "GHSA-7wqf-h36w-47mc",
      "package": "airflow-with-cloudant",
      "reason": "human_openvex_exists"
    },
    {
      "advisory_id": "GHSA-c732-xvv8-g94c",
      "package": "airflow-with-cloudant",
      "reason": "human_openvex_exists"
    },
    {
      "advisory_id": "GHSA-rmf2-pwfq-h75j",
      "package": "airflow-with-cloudant",
      "reason": "human_openvex_exists"
    },
    {
      "advisory_id": "PYSEC-2023-314",